<?xml version="1.0" encoding="UTF-8"?>
<documentIndex
	xmlns:xsi="http://www.w3.org/2001/XMLSchema-instance"
	xmlns="http://www.armedia.com/ns/caliente/engine/xml"
	xsi:schemaLocation="http://www.armedia.com/ns/caliente/engine/xml platform:/resource/caliente-engine-impl-xml/src/main/resources/caliente-engine-xml.xsd ">
	<document>
		<historyId>id</historyId>
		<count>1</count>
		<version>
			<id>id</id>
			<path>path</path>
			<name>name</name>
			<location>location</location>
			<type>objectType</type>
			<historyId>historyId</historyId>
			<version>version</version>
			<current>true</current>
			<format>crap</format>
			<size>10</size>
		</version>
	</document>
	<document>
		<historyId>id</historyId>
		<count>1</count>
		<version>
			<id>id</id>
			<path>path</path>
			<name>name</name>
			<location>location</location>
			<type>objectType</type>
			<historyId>historyId</historyId>
			<version>version</version>
			<current>true</current>
			<size>10</size>
		</version>
	</document>
</documentIndex>
