<?xml version="1.0" encoding="UTF-8"?>
<folder
	xmlns:xsi="http://www.w3.org/2001/XMLSchema-instance"
	xmlns="http://www.armedia.com/ns/caliente/engine/xml"
	xsi:schemaLocation="http://www.armedia.com/ns/caliente/engine/xml platform:/resource/caliente-engine-xml/src/main/resources/caliente-engine-xml.xsd ">
	<id>id</id>
	<parentId>parentId</parentId>
	<name>name</name>
	<type>type</type>
	<sourcePath>sourcePath</sourcePath>
	<creationDate>2001-12-31T12:00:00</creationDate>
	<creator>creator</creator>
	<modificationDate>2001-12-31T12:00:00</modificationDate>
	<modifier>modifier</modifier>
	<acl>acl</acl>
	<attributes>
		<attribute dataType="BOOLEAN" name="xxx">
			<value>value</value>
		</attribute>
		<attribute dataType="BOOLEAN" name="xxx">
			<value>value</value>
			<value>value</value>
			<value>value</value>
			<value>value</value>
			<value>value</value>
			<value>value</value>
			<value>value</value>
			<value>value</value>
			<value>value</value>
			<value>value</value>
			<value>value</value>
			<value>value</value>
			<value>value</value>
			<value>value</value>
		</attribute>
		<attribute dataType="BOOLEAN" name="xxx">
			<value>value</value>
		</attribute>
		<attribute dataType="BOOLEAN" name="xxx">
			<value>value</value>
		</attribute>
		<attribute dataType="BOOLEAN" name="xxx">
			<value>value</value>
		</attribute>
	</attributes>
	<properties>
		<property dataType="BOOLEAN" name="xxx" repeating="true">
			<value>value1</value>
			<value>value2</value>
			<value>value3</value>
			<value>value4</value>
			<value>value5</value>
			<value>value6</value>
		</property>
	</properties>
</folder>
