<?xml version="1.0" encoding="UTF-8"?>
<acls
	xmlns:xsi="http://www.w3.org/2001/XMLSchema-instance"
	xmlns="http://www.armedia.com/ns/caliente/engine/xml"
	xsi:schemaLocation="http://www.armedia.com/ns/caliente/engine/xml  ../../../src/main/resources/caliente-engine-xml.xsd ">
	<acl>
		<id>id</id>
		<description>description</description>
		<users>
			<permit extended="ss" level="1" name="dd" type="ACCESS" />
		</users>
		<groups>
			<permit extended="xx" level="2" name="ff" type="ACCESS" />
		</groups>
		<attributes>
			<attribute dataType="BOOLEAN" name="xxx">
				<value>value1</value>
				<value>value2</value>
				<value>value3</value>
				<value>value4</value>
				<value>value5</value>
				<value>value6</value>
			</attribute>
		</attributes>
		<properties>
			<property dataType="BOOLEAN" name="xxx">
				<value>value1</value>
				<value>value2</value>
				<value>value3</value>
				<value>value4</value>
				<value>value5</value>
				<value>value6</value>
			</property>
		</properties>
	</acl>
</acls>
