<?xml version="1.0" encoding="UTF-8"?>
<groups
	xmlns:xsi="http://www.w3.org/2001/XMLSchema-instance"
	xmlns="http://www.armedia.com/ns/caliente/engine/xml"
	xsi:schemaLocation="http://www.armedia.com/ns/caliente/engine/xml platform:/resource/caliente-engine-impl-xml/src/main/resources/caliente-engine-xml.xsd ">
	<group>
		<name>name</name>
		<type>type</type>
		<email>email</email>
		<source>source</source>
		<administrator>administrator</administrator>
		<displayName>displayName</displayName>
		<users>
			<user>user</user>
		</users>
		<groups>
			<group>group</group>
		</groups>
		<attributes>
			<attribute dataType="BOOLEAN" name="xxx">
				<value>value1</value>
				<value>value2</value>
				<value>value3</value>
				<value>value4</value>
				<value>value5</value>
				<value>value6</value>
			</attribute>
		</attributes>
		<properties>
			<property dataType="BOOLEAN" name="xxx" repeating="true">
				<value>value1</value>
				<value>value2</value>
				<value>value3</value>
				<value>value4</value>
				<value>value5</value>
				<value>value6</value>
			</property>
		</properties>
	</group>
</groups>
